id,nombre,idioma,fecha_adquisicion,fecha_estreno,genero_id,duracion_h,resena,nivelpublico_id
MOV000456,"Fistful of Dollars, A",GB,2021-06-24,2021-06-25,GP0000006,1.5,Affect reach religious concern nearly.,RE00000004
MOV000457,Fitzcarraldo,GB,2021-07-13,2021-07-24,GP0000004,1.5,Along much door nation.,RE00000001
MOV000458,Flock of Dodos,GB,2021-07-05,2021-07-06,GP0000008,1.5,Majority without enter best chance respond.,RE00000001
MOV000459,"Fly, The",GB,2021-08-23,2021-08-24,GP0000008,1.5,Anyone peace rich laugh.,RE00000004
MOV000460,"Fog, The",GB,2021-07-13,2021-08-09,GP0000023,2.0,Involve professor argue computer relationship true.,RE00000002
MOV000461,Follow That Bird,GB,2021-01-31,2021-02-10,GP0000017,1.75,Election challenge she close free team.,RE00000004
MOV000462,Footloose,GB,2021-11-10,2021-11-18,GP0000013,2.0,View free arrive matter send recently short.,RE00000001
MOV000463,For Your Consideration,GB,2021-08-23,2021-09-06,GP0000018,1.5,Home ok position police light thought various analysis.,RE00000002
MOV000464,For a Few Dollars More,GB,2021-08-04,2021-08-11,GP0000021,2.0,Success quickly energy interview end.,RE00000004
MOV000465,Forbidden Zone,GB,2021-11-16,2021-12-06,GP0000004,2.0,Tax huge behind customer good.,RE00000001
MOV000466,Force Majeure,GB,2021-04-01,2021-04-22,GP0000014,1.75,Evidence drive rock take.,RE00000004
MOV000467,Forrest Gump,GB,2021-08-14,2021-09-11,GP0000010,1.75,Not choose weight.,RE00000001
MOV000468,"Fountain, The",GB,2021-11-22,2021-11-27,GP0000024,2.0,How take peace table series charge.,RE00000002
MOV000469,"Fountainhead, The",GB,2021-03-27,2021-04-20,GP0000009,1.75,Standard back small front.,RE00000002
MOV000470,Four Flies on Grey Velvet,GB,2021-04-21,2021-05-20,GP0000001,2.0,Have black public writer before.,RE00000004
MOV000471,Four Rooms,GB,2021-10-02,2021-10-16,GP0000010,2.0,Art shake join want cause campaign.,RE00000004
MOV000472,"Fourth Kind, The",GB,2021-08-27,2021-09-17,GP0000024,1.5,Look follow oil should account relationship four.,RE00000003
MOV000473,Foxy Brown,GB,2021-10-26,2021-10-30,GP0000022,1.5,Window range task task parent become.,RE00000001
MOV000474,Frances Ha,GB,2021-01-07,2021-01-29,GP0000023,1.5,Drug tell fear soldier board chair.,RE00000003
MOV000475,Frankenstein,GB,2021-08-13,2021-09-09,GP0000019,1.0,Social do direction blood financial song.,RE00000003
MOV000476,Freaks,GB,2021-01-17,2021-02-07,GP0000018,1.75,Which report attack onto just relationship smile.,RE00000002
MOV000477,Freddy vs Jason,GB,2021-02-10,2021-03-11,GP0000015,2.0,Many off possible school.,RE00000004
MOV000478,Freeway,GB,2021-02-17,2021-03-16,GP0000018,1.75,Short real society office impact religious.,RE00000002
MOV000479,Friday,GB,2021-12-11,2021-12-28,GP0000017,1.0,Above watch side safe management least.,RE00000001
MOV000480,Friday the 13th (Jason Series),GB,2021-07-03,2021-07-05,GP0000007,1.75,Use suffer spend.,RE00000004
MOV000481,Fright Night,GB,2021-02-12,2021-03-06,GP0000015,1.75,Behind song keep money example report.,RE00000001
MOV000482,"Frighteners, The",GB,2021-07-21,2021-07-27,GP0000002,1.5,Their civil red huge away.,RE00000001
MOV000483,From Beyond,GB,2021-05-03,2021-05-21,GP0000017,1.0,Different event against fill put represent whom.,RE00000004
MOV000484,From Dusk Till Dawn,GB,2021-08-20,2021-08-20,GP0000020,1.75,Summer four resource office another paper customer marriage.,RE00000002
MOV000485,From Hell,GB,2021-09-14,2021-09-14,GP0000002,2.0,Pressure maintain inside class.,RE00000001
MOV000486,Frost Nixon,GB,2021-05-12,2021-06-02,GP0000007,1.5,Board stuff father safe sound.,RE00000002
MOV000487,Frozen,GB,2021-09-14,2021-10-08,GP0000013,2.0,Law much vote so stage point.,RE00000002
MOV000488,Fruitvale Station,GB,2021-12-08,2022-01-06,GP0000021,1.0,Open rule require water firm position reach.,RE00000001
MOV000489,Full Metal Jacket,GB,2021-03-16,2021-03-23,GP0000006,1.0,Really economic Mrs yet use write cut.,RE00000001
MOV000490,"Funeral, The",GB,2021-01-09,2021-02-07,GP0000020,1.0,Fly produce their Congress quite.,RE00000004
MOV000491,Funny Games,GB,2021-06-21,2021-07-06,GP0000017,2.0,Gas stock career talk.,RE00000001
MOV000492,Fur,GB,2021-12-03,2021-12-22,GP0000023,1.0,Have class or trial.,RE00000002
MOV000493,"Future, The",GB,2021-10-21,2021-10-22,GP0000020,1.0,Wind police offer present must she beautiful.,RE00000002
MOV000494,Galaxy Quest,GB,2021-08-31,2021-09-03,GP0000022,1.75,Prepare let hard dinner why.,RE00000001
MOV000495,Galaxy of Terror,GB,2021-05-05,2021-05-07,GP0000016,1.75,Interesting police experience.,RE00000002
MOV000496,"Game, The",GB,2021-09-07,2021-09-28,GP0000019,1.5,Continue manage me politics nearly.,RE00000001
MOV000497,Gamera: Guardian of the Universe,GB,2021-11-02,2021-11-16,GP0000014,1.75,Suggest agent option word.,RE00000001
MOV000498,Gangs of Wasseypur: Part One (2012),GB,2021-02-22,2021-03-03,GP0000003,1.0,Tv better under.,RE00000002
MOV000499,Gangster (2006),GB,2021-03-24,2021-04-06,GP0000005,1.5,Question more government up hear hear land end.,RE00000001
MOV000500,Garam Hawa (1973),GB,2021-08-18,2021-08-28,GP0000023,1.0,Seem move artist newspaper.,RE00000002
MOV000501,Gattaca,GB,2021-02-24,2021-02-25,GP0000001,1.0,Realize it summer start add prepare.,RE00000004
MOV000502,Gentlemen Prefer Blondes,GB,2021-04-10,2021-04-18,GP0000009,1.0,Light check reality smile improve.,RE00000001
MOV000503,Get Carter,GB,2021-10-01,2021-10-10,GP0000006,2.0,Itself create reduce color industry.,RE00000001
MOV000504,Get Duked!,GB,2021-05-18,2021-05-21,GP0000011,1.5,Organization market situation other star discuss likely.,RE00000003
MOV000505,Get On the Bus,GB,2021-10-09,2021-10-25,GP0000005,1.75,Pattern air program meet.,RE00000003
MOV000506,Get Out,GB,2021-07-23,2021-07-23,GP0000004,1.75,Spring when indicate physical.,RE00000004
MOV000507,Ghajini (2008),GB,2021-04-22,2021-05-05,GP0000014,1.5,Major current with film base.,RE00000004
MOV000508,Ghost Dog: The Way of the Samurai,GB,2021-02-21,2021-02-22,GP0000023,1.0,Usually instead land environmental.,RE00000003
MOV000509,"Ghost Story, A",GB,2021-10-31,2021-11-03,GP0000024,1.0,Beautiful success different.,RE00000002
MOV000510,Ghost World,GB,2021-04-03,2021-04-27,GP0000018,1.0,Court write section food point wife fish fact.,RE00000002
MOV000511,Ghost in the Shell,GB,2021-07-05,2021-07-20,GP0000023,1.0,Know international allow yard short list kind decision.,RE00000004
MOV000512,Ghosts of Mars,GB,2021-04-05,2021-04-19,GP0000022,1.5,Inside too similar serve.,RE00000002
MOV000513,Ghoulies (Series),GB,2021-12-02,2021-12-05,GP0000017,1.5,Century someone member.,RE00000002
MOV000514,Giallo,GB,2021-11-27,2021-11-29,GP0000002,1.75,Maybe class answer nothing realize.,RE00000004
MOV000515,Ginger Snaps (Series),GB,2021-08-03,2021-08-31,GP0000014,1.5,Player loss down million source.,RE00000002
MOV000516,Ginger and Rosa,GB,2021-03-07,2021-03-12,GP0000022,1.75,Field official enter Republican stop defense onto foot.,RE00000003
MOV000517,"Girl, Interrupted",GB,2021-04-28,2021-05-03,GP0000017,1.5,Rock leader both test road evidence.,RE00000002
MOV000518,"Girlfriend Experience, The",GB,2021-08-20,2021-08-29,GP0000009,1.0,Accept decide particularly perform available.,RE00000004
MOV000519,Giuseppe Makes A Movie,GB,2021-04-28,2021-05-12,GP0000024,1.5,Increase family article federal foreign.,RE00000002
MOV000520,Glen or Glenda,GB,2021-07-25,2021-08-04,GP0000010,1.0,Maintain network lot exactly surface beautiful option.,RE00000004
MOV000521,Glengarry Glen Ross,GB,2021-04-05,2021-05-03,GP0000020,1.5,Artist she main bring officer shoulder different.,RE00000001
MOV000522,God Bless America,GB,2021-09-29,2021-10-24,GP0000013,1.5,Work media reflect across herself entire pressure.,RE00000001
MOV000523,"God Who Wasn't There, The",GB,2021-01-29,2021-02-01,GP0000019,1.0,Religious than class drop write election.,RE00000004
MOV000524,"Godfather, The",GB,2021-10-21,2021-11-10,GP0000022,2.0,Value scientist herself option heavy yet.,RE00000002
MOV000525,Godzilla: Final Wars,GB,2021-09-04,2021-10-02,GP0000014,1.75,Deal then bit home paper fund.,RE00000001
MOV000526,Gojira,GB,2021-08-16,2021-09-11,GP0000021,1.5,Growth keep clear night.,RE00000002
MOV000527,GolMaal (1979),GB,2021-03-24,2021-04-17,GP0000011,1.75,Sign break important collection start include.,RE00000001
MOV000528,Gold Diggers of 1933,GB,2021-08-27,2021-09-05,GP0000021,1.5,Quite affect imagine control ball really other.,RE00000004
MOV000529,Goldeneye,GB,2021-06-30,2021-07-02,GP0000006,2.0,Animal stage beyond people enjoy.,RE00000004
MOV000530,Gone Girl,GB,2021-07-07,2021-07-16,GP0000008,1.75,Test side leave either.,RE00000001
MOV000531,Gone with the Wind,GB,2021-09-08,2021-09-30,GP0000010,1.75,That financial family company people.,RE00000004
MOV000532,"Good Neighbor, The",GB,2021-05-06,2021-05-12,GP0000015,1.75,Those nation seek.,RE00000002
MOV000533,Good Night and Good Luck,GB,2021-08-05,2021-08-21,GP0000024,1.5,Nice believe must try.,RE00000001
MOV000534,Good Time,GB,2021-09-03,2021-09-16,GP0000002,1.0,Require why blue price.,RE00000003
MOV000535,"Good, the Bad and the Ugly, The",GB,2021-02-25,2021-03-21,GP0000019,1.75,Real rise whose.,RE00000001
MOV000536,"Gore Gore Girls, The",GB,2021-11-26,2021-11-26,GP0000021,2.0,Cell chance rule near start exist fly.,RE00000002
MOV000537,Gothic,GB,2021-03-25,2021-04-02,GP0000003,1.75,Control service hundred occur throughout difference.,RE00000004
MOV000538,Graphic Sexual Horror,GB,2021-06-04,2021-06-05,GP0000005,2.0,Indicate either movement case PM no notice wait.,RE00000002
MOV000539,Grave of the Fireflies,GB,2021-03-18,2021-03-21,GP0000008,1.75,Black long side can future question.,RE00000003
MOV000540,"Greasy Strangler, The",GB,2021-09-13,2021-09-23,GP0000001,1.5,Day music behavior.,RE00000004
MOV000541,"Great Dictator, The",GB,2021-11-03,2021-11-25,GP0000013,1.75,Arm PM every these own yes.,RE00000003
MOV000542,"Great Santini, The",GB,2021-07-12,2021-07-16,GP0000004,1.0,Concern million total than middle.,RE00000004
MOV000543,"Green Inferno, The",GB,2021-06-21,2021-07-01,GP0000015,1.0,Its add nor ahead discussion body look.,RE00000003
MOV000544,Green Room,GB,2021-05-31,2021-06-27,GP0000006,1.75,Tax away everyone space.,RE00000004
MOV000545,Greener Grass,GB,2021-01-25,2021-02-21,GP0000008,1.75,South money act knowledge source.,RE00000002
MOV000546,Gremlins,GB,2021-04-17,2021-04-17,GP0000014,2.0,Score natural across compare green window arrive safe.,RE00000001
MOV000547,Gremlins 2,GB,2021-04-11,2021-04-25,GP0000001,1.75,In professor social financial pick often.,RE00000001
MOV000548,Grizzly Man,GB,2021-10-09,2021-11-02,GP0000005,2.0,Fly event particularly drop find technology.,RE00000001
MOV000549,"Guest, The",GB,2021-10-22,2021-11-06,GP0000013,1.0,Seat hundred dog might page letter join.,RE00000001
MOV000550,Guide (1965),GB,2021-10-06,2021-10-16,GP0000024,1.5,Decade simply between chance tree.,RE00000002
MOV000551,"Guilty, The",GB,2021-07-15,2021-07-28,GP0000021,2.0,Movement walk late back relate sure.,RE00000004
MOV000552,Gummo,GB,2021-06-23,2021-06-30,GP0000014,1.75,Boy individual inside produce.,RE00000001
MOV000553,Gunga Jumna (1961),GB,2021-10-05,2021-10-23,GP0000021,1.5,Attention mouth second tell finally.,RE00000003
MOV000554,Hail Satan,GB,2021-02-26,2021-03-17,GP0000020,1.75,Study radio dinner specific question ever finish.,RE00000002
MOV000555,Hairspray,GB,2021-04-04,2021-04-26,GP0000001,2.0,Front late audience size discover.,RE00000004
MOV000556,Halloween,GB,2021-04-28,2021-05-11,GP0000005,1.5,Sell responsibility trip picture television trip everything.,RE00000003
MOV000557,Halloween (Michael Myers Series),GB,2021-05-21,2021-06-14,GP0000023,2.0,Activity cost red where finish.,RE00000004
MOV000558,Halloween 2,GB,2021-08-02,2021-08-20,GP0000016,1.75,Area pick hospital involve western no minute.,RE00000001
MOV000559,Hamlet 2,GB,2021-04-21,2021-04-28,GP0000022,1.75,Strong certain prove fast.,RE00000001
MOV000560,"Handmaiden, The",GB,2021-02-08,2021-02-25,GP0000014,1.5,When goal medical especially day.,RE00000001
MOV000561,Hands on a Hardbody,GB,2021-01-26,2021-02-19,GP0000004,1.5,Rather woman specific event exist candidate.,RE00000003
MOV000562,Hanna,GB,2021-01-10,2021-02-06,GP0000008,1.75,Shake cause material policy lay officer kind.,RE00000001
MOV000563,Hannah and Her Sisters,GB,2021-12-10,2021-12-26,GP0000024,1.5,Large become understand.,RE00000002
MOV000564,"Happening, The",GB,2021-06-29,2021-07-08,GP0000025,1.5,Travel nearly whom include.,RE00000004
MOV000565,Happiness,GB,2021-10-15,2021-11-01,GP0000013,1.0,News sure story hear final including artist.,RE00000001
MOV000566,"Happiness of the Katakuris, The",GB,2021-02-20,2021-03-14,GP0000003,1.75,Dog why easy drive side upon.,RE00000004
MOV000567,Happy Accidents,GB,2021-10-07,2021-10-09,GP0000017,1.75,Society every week until.,RE00000002
MOV000568,Happy Go Lucky,GB,2021-08-29,2021-09-25,GP0000022,1.75,Cultural admit phone listen even democratic.,RE00000002
MOV000569,Hard Candy,GB,2021-08-31,2021-09-28,GP0000006,1.0,Anything side language dark.,RE00000004
MOV000570,Hard Rock Zombies,GB,2021-04-01,2021-04-29,GP0000020,2.0,Religious single agree yourself month me.,RE00000004
MOV000571,Hard Ticket to Hawaii,GB,2021-01-10,2021-01-11,GP0000008,2.0,Edge and always herself bad also wear experience.,RE00000003
MOV000572,Hardcore Henry,GB,2021-04-18,2021-04-20,GP0000003,2.0,Night another rich subject.,RE00000003
MOV000573,Harry Brown,GB,2021-01-29,2021-02-26,GP0000017,1.75,Over sister accept later raise.,RE00000004
MOV000574,Harvey,GB,2021-06-11,2021-06-15,GP0000009,1.0,Head organization begin describe foot letter chance.,RE00000003
MOV000575,Hatchet,GB,2021-05-12,2021-06-06,GP0000006,1.0,Explain television themselves tough either perhaps old.,RE00000004
MOV000576,Hatchet 2,GB,2021-05-31,2021-06-26,GP0000024,2.0,Technology citizen television site clear after why fly.,RE00000002
MOV000577,Hatchet 3,GB,2021-09-05,2021-09-19,GP0000023,2.0,Operation wide receive great.,RE00000002
MOV000578,"Hateful Eight, The",GB,2021-08-18,2021-09-04,GP0000019,1.5,Situation decade democratic something child scientist.,RE00000004
MOV000579,"Haunted World of El Superbeasto, The",GB,2021-11-01,2021-11-12,GP0000007,1.75,Audience most second avoid top officer play.,RE00000003
MOV000580,"Haunting, The",GB,2021-02-17,2021-03-08,GP0000016,1.0,Discuss common field step.,RE00000002
MOV000581,Hausu,GB,2021-07-19,2021-07-21,GP0000025,1.0,Politics authority work law social.,RE00000003
MOV000582,Haywire,GB,2021-09-07,2021-09-20,GP0000012,2.0,Case hot point raise use.,RE00000004
MOV000583,He Died with a Felafel in His Hand,GB,2021-04-07,2021-04-15,GP0000018,1.0,Nice later fill bill American outside.,RE00000002
MOV000584,He Got Game,GB,2021-06-01,2021-06-25,GP0000013,1.5,Safe plan set phone word woman.,RE00000003
MOV000585,Head,GB,2021-11-06,2021-11-08,GP0000013,2.0,Land professional agency quickly state current.,RE00000003
MOV000586,Heartbeeps,GB,2021-06-18,2021-06-18,GP0000024,1.75,Three yourself position world together.,RE00000004
MOV000587,Hearts and Minds,GB,2021-09-09,2021-09-30,GP0000019,1.75,Beat last nice assume government.,RE00000001
MOV000588,Heat,GB,2021-10-02,2021-10-14,GP0000012,1.75,Value ten national thousand which member cost.,RE00000004
MOV000589,Heavenly Creatures,GB,2021-08-24,2021-08-31,GP0000003,2.0,Now firm hotel hit catch resource.,RE00000003
MOV000590,Heavy Metal,GB,2021-06-10,2021-07-09,GP0000008,1.0,Region order seat behind key want.,RE00000002
MOV000591,Hell Ride,GB,2021-04-03,2021-05-02,GP0000003,1.0,Move what wall design.,RE00000002
MOV000592,Hellraiser (Pinhead Series),GB,2021-11-14,2021-12-05,GP0000007,1.0,Less leg condition situation friend him idea.,RE00000001
MOV000593,Henry Fool,GB,2021-06-05,2021-06-08,GP0000010,2.0,Role radio debate life dog.,RE00000002
MOV000594,Henry: Portrait of a Serial Killer,GB,2021-07-15,2021-08-03,GP0000007,2.0,Join Mr might nor trip network space.,RE00000002
MOV000595,Her,GB,2021-09-18,2021-09-24,GP0000009,1.75,Determine seven room country fund.,RE00000004
MOV000596,Hera Pheri (2000),GB,2021-09-28,2021-09-30,GP0000003,1.0,Soon employee finally keep shake production.,RE00000003
MOV000597,Here Comes the Devil,GB,2021-03-20,2021-03-25,GP0000014,2.0,More bring beautiful manage give.,RE00000002
MOV000598,Hereditary,GB,2021-09-18,2021-10-16,GP0000020,2.0,Car off near southern four hair.,RE00000001
MOV000599,Hero,GB,2021-07-11,2021-08-01,GP0000012,1.5,Guy key stop positive trouble onto.,RE00000003
MOV000600,High Tension,GB,2021-05-18,2021-06-16,GP0000013,1.0,Television side imagine possible.,RE00000003
MOV000601,"Hills Have Eyes, The",GB,2021-04-02,2021-04-22,GP0000013,1.75,Food big street appear.,RE00000001
MOV000602,His House,GB,2021-02-18,2021-03-11,GP0000003,1.75,Market western talk if.,RE00000004
MOV000603,"History of Violence, A",GB,2021-10-11,2021-10-18,GP0000005,2.0,Recognize you play issue short able show.,RE00000001
MOV000604,"Hitcher, The",GB,2021-07-24,2021-08-22,GP0000018,1.5,Act image seat often.,RE00000002
MOV000605,Hits,GB,2021-11-29,2021-12-17,GP0000019,1.75,Risk owner month.,RE00000001
MOV000606,Hobo with a Shotgun,GB,2021-10-04,2021-10-04,GP0000023,1.75,Structure response difference enough.,RE00000001
MOV000607,Hocus Pocus,GB,2021-04-19,2021-04-21,GP0000020,1.5,Catch time ten because.,RE00000002
MOV000608,Holy Motors,GB,2021-01-29,2021-02-02,GP0000019,1.5,Early culture family rich we free.,RE00000003
MOV000609,Honey Boy,GB,2021-09-23,2021-09-30,GP0000004,1.75,Spring baby his something.,RE00000004
MOV000610,Honey I Shrunk the Kids,GB,2021-07-11,2021-08-01,GP0000005,1.75,Particular once consumer specific listen move.,RE00000004
MOV000611,Honeymoon,GB,2021-02-12,2021-03-11,GP0000011,1.0,Management that risk interest because mean sure.,RE00000003
MOV000612,Horns,GB,2021-08-31,2021-09-01,GP0000021,1.5,Machine important blue agent tend clear position.,RE00000003
MOV000613,Horror of Dracula,GB,2021-02-03,2021-02-21,GP0000014,2.0,Near since win four shoulder nature.,RE00000002
MOV000614,Horse Girl,GB,2021-03-29,2021-04-13,GP0000024,1.0,Thought budget many read our mean science.,RE00000001
MOV000615,"Host, The",GB,2021-10-09,2021-10-30,GP0000010,1.0,Option manager dream southern stock bank truth.,RE00000003
MOV000616,Hostage,GB,2021-01-10,2021-01-13,GP0000025,2.0,Other list camera let to tax effort.,RE00000004
MOV000617,Hostel,GB,2021-03-02,2021-03-18,GP0000012,1.0,Community ability ready second soldier travel.,RE00000001
MOV000618,Hostel 2,GB,2021-07-03,2021-07-05,GP0000011,2.0,Company sure entire.,RE00000003
MOV000619,Hot Rod,GB,2021-09-06,2021-09-24,GP0000001,1.75,Tell almost hot teacher lay hot your.,RE00000003
MOV000620,Hot Tub Time Machine,GB,2021-10-15,2021-11-12,GP0000025,1.5,Bag health perform somebody represent watch market.,RE00000002
MOV000621,House,GB,2021-08-21,2021-09-11,GP0000011,1.5,Leg offer arm series.,RE00000002
MOV000622,"House That Jack Built, The",GB,2021-04-29,2021-05-03,GP0000004,2.0,Issue government party.,RE00000001
MOV000623,"House by the Cemetery, The",GB,2021-10-28,2021-11-24,GP0000022,1.0,Yard interest tonight should site.,RE00000001
MOV000624,House of 1000 Corpses,GB,2021-01-25,2021-02-20,GP0000005,1.75,Per he color center guy word voice.,RE00000002
MOV000625,House of Wax (1953),GB,2021-04-11,2021-05-09,GP0000009,1.75,Any plan involve throw second.,RE00000002
MOV000626,House of Wax (2005),GB,2021-10-01,2021-10-06,GP0000024,1.5,Government fill explain very now true soon performance.,RE00000001
MOV000627,"House of the Devil, The",GB,2021-01-18,2021-01-27,GP0000015,2.0,Best popular middle expert policy decade.,RE00000003
MOV000628,House on Haunted Hill,GB,2021-01-19,2021-02-12,GP0000019,1.5,Yeah nor throughout lay system.,RE00000001
MOV000629,"House on Sorority Row, The",GB,2021-05-25,2021-05-27,GP0000001,2.0,Similar certainly offer who section laugh.,RE00000004
MOV000630,"House with a Clock in Its Walls, The",GB,2021-03-20,2021-03-30,GP0000010,1.75,Ever government mean professor action make we skill.,RE00000003
MOV000631,How to Lose a Guy in Ten Days,GB,2021-05-27,2021-06-05,GP0000006,2.0,Degree where two structure hair ready.,RE00000004
MOV000632,How to Talk to Girls at Parties,GB,2021-06-06,2021-06-26,GP0000021,2.0,Crime cost hot catch threat college.,RE00000002
MOV000633,Howl's Moving Castle,GB,2021-06-16,2021-06-24,GP0000025,1.5,Themselves game world.,RE00000001
MOV000634,"Hudsucker Proxy, The",GB,2021-05-20,2021-06-05,GP0000022,1.75,Old of already.,RE00000004
MOV000635,Hum Aapke Hain Koun…! (1994),GB,2021-01-29,2021-02-02,GP0000021,1.0,Herself country but network lay generation.,RE00000003
MOV000636,Hum Hain Rahi Pya Ke (1993),GB,2021-10-06,2021-10-19,GP0000019,1.5,Suggest everyone reach visit themselves door while effort.,RE00000001
MOV000637,"Human Centipede 2, The",GB,2021-06-26,2021-06-28,GP0000016,1.0,Bank local thing yourself speech.,RE00000002
MOV000638,"Human Centipede 3, The",GB,2021-05-26,2021-06-08,GP0000013,1.0,Never kid western without month even.,RE00000004
MOV000639,"Human Centipede, The",GB,2021-04-21,2021-05-10,GP0000008,2.0,Player old exist peace fast value five.,RE00000002
MOV000640,"Human Tornado, The",GB,2021-04-15,2021-05-04,GP0000025,1.5,Red fish think order smile enjoy.,RE00000004
MOV000641,Humanoids from the Deep,GB,2021-05-02,2021-05-09,GP0000004,1.0,Set camera field what beat side economy.,RE00000003
MOV000642,"Hunchback of Notre Dame, The",GB,2021-03-19,2021-03-21,GP0000001,1.75,Exist not yeah without let.,RE00000003
MOV000643,Hunger,GB,2021-09-09,2021-09-18,GP0000001,1.0,Spring often candidate middle official write order.,RE00000001
MOV000644,"Hunt for Red October, The",GB,2021-05-30,2021-05-30,GP0000013,1.75,Interesting hot team all step explain throughout.,RE00000003
MOV000645,"Hunt, The",GB,2021-06-20,2021-07-04,GP0000022,1.0,Fish indicate his community.,RE00000004
MOV000646,I Know What You Did Last Summer (Series),GB,2021-07-05,2021-07-17,GP0000010,1.5,Performance last finally serious.,RE00000003
MOV000647,I Saw the Devil,GB,2021-07-28,2021-08-25,GP0000004,1.5,Quite person rise happen degree Democrat behind.,RE00000002
MOV000648,I Stand Alone,GB,2021-03-08,2021-04-03,GP0000016,1.75,Message actually age success cultural.,RE00000003
MOV000649,I'm a Cyborg But That's Ok,GB,2021-11-18,2021-12-08,GP0000014,1.75,Media note television trouble.,RE00000003
MOV000650,Ice Cream Man,GB,2021-06-08,2021-07-07,GP0000005,2.0,Property final nearly major increase.,RE00000003
MOV000651,Ichi the Killer,GB,2021-04-22,2021-05-20,GP0000003,1.5,Skill write manage task.,RE00000003
MOV000652,Idiocracy,GB,2021-09-28,2021-10-16,GP0000006,2.0,Small traditional market indeed evening service.,RE00000002
MOV000653,"Idiots, The",GB,2021-05-01,2021-05-21,GP0000008,1.5,Move generation agreement after.,RE00000004
MOV000654,Idle Hands,GB,2021-08-04,2021-08-27,GP0000016,1.75,Production foreign sea most.,RE00000004
MOV000655,If Beale Street Could Talk,GB,2021-11-17,2021-11-20,GP0000021,2.0,Sign his operation college.,RE00000001
MOV000656,"Imposter, The",GB,2021-02-17,2021-03-18,GP0000009,1.5,Example effort about whose explain play provide.,RE00000004
MOV000657,In a Valley of Violence,GB,2021-07-29,2021-08-24,GP0000014,1.5,International how room each paper.,RE00000002
MOV000658,In the Face of Evil,GB,2021-11-12,2021-12-09,GP0000015,2.0,Interest nature threat ability animal fall.,RE00000001
MOV000659,In the Mouth of Madness,GB,2021-02-24,2021-03-13,GP0000022,2.0,Serious why speech piece country specific recent.,RE00000004
MOV000660,Indie Game,GB,2021-01-15,2021-01-31,GP0000010,2.0,Full music expert fight energy weight provide.,RE00000002
MOV000661,Industrial Symphony No. 1,GB,2021-01-07,2021-02-01,GP0000008,1.5,Military senior stop.,RE00000001
MOV000662,Inglourious Basterds,GB,2021-09-16,2021-09-29,GP0000021,1.75,Create less maybe toward activity give involve big.,RE00000002
MOV000663,Ingrid Goes West,GB,2021-01-18,2021-02-05,GP0000010,1.5,Notice entire minute middle drive at.,RE00000001
MOV000664,Inland Empire,GB,2021-05-11,2021-06-06,GP0000022,1.75,Push let despite peace wish phone significant medical.,RE00000001
MOV000665,InnerSpace,GB,2021-02-20,2021-03-02,GP0000005,2.0,Author could professor early summer general.,RE00000001
MOV000666,"Innkeepers, The",GB,2021-02-10,2021-03-02,GP0000017,1.5,Wall popular foot occur sit government.,RE00000001
MOV000667,Inside,GB,2021-01-25,2021-02-20,GP0000004,2.0,Describe she first bill.,RE00000003
MOV000668,Inside Llewyn Davis,GB,2021-03-20,2021-03-22,GP0000008,1.0,Save hand truth business.,RE00000002
MOV000669,"Insider, The",GB,2021-01-14,2021-01-15,GP0000011,1.0,Debate our affect guess modern visit plant.,RE00000002
MOV000670,Insidious,GB,2021-05-07,2021-05-23,GP0000017,2.0,Ok factor now tell ground arrive old choose.,RE00000002
MOV000671,Insomnia,GB,2021-05-14,2021-05-18,GP0000020,1.0,Marriage mean main threat heavy debate.,RE00000002
MOV000672,Intacto,GB,2021-02-14,2021-02-14,GP0000017,1.5,Billion put movie suggest us one.,RE00000003
MOV000673,Interview With the Vampire,GB,2021-07-12,2021-08-10,GP0000002,2.0,Leave size north class turn feel environmental.,RE00000002
MOV000674,Intolerable Cruelty,GB,2021-03-13,2021-03-24,GP0000001,1.5,See data democratic debate bit wonder model.,RE00000003
MOV000675,Intruder,GB,2021-10-03,2021-10-13,GP0000008,1.75,Hair wife return buy.,RE00000004
MOV000676,Invaders from Mars,GB,2021-07-17,2021-07-23,GP0000022,2.0,Two magazine decade include room.,RE00000002
MOV000677,Invasion of the Body Snatchers,GB,2021-04-25,2021-04-25,GP0000024,1.5,Our yourself road rather sense.,RE00000001
MOV000678,"Invention of Lying, The",GB,2021-02-08,2021-02-18,GP0000002,1.75,Some public staff yes anything.,RE00000003
MOV000679,Invincible,GB,2021-12-04,2021-12-31,GP0000011,1.75,Join structure throughout.,RE00000001
