id,nombre,idioma,fecha_adquisicion,fecha_estreno,genero_id,duracion_h,resena,nivelpublico_id
MOV000680,"Invitation, The",GB,2021-10-04,2021-10-14,GP0000002,2.0,Month who determine road suggest party list.,RE00000004
MOV000681,"Iron Giant, The",GB,2021-11-12,2021-11-24,GP0000018,1.0,As until positive nation.,RE00000004
MOV000682,Iron Sky,GB,2021-06-15,2021-06-16,GP0000019,1.75,All condition official letter participant nature.,RE00000001
MOV000683,Irreversible,GB,2021-05-29,2021-06-03,GP0000011,1.75,Relate idea fight apply.,RE00000003
MOV000684,Isle of Dogs,GB,2021-06-24,2021-07-13,GP0000019,1.5,Cell billion authority business little north.,RE00000004
MOV000685,It,GB,2021-01-18,2021-01-28,GP0000006,1.5,Recent local fish maintain year go wind.,RE00000003
MOV000686,It Follows,GB,2021-10-03,2021-10-10,GP0000002,1.75,Those may leader program consumer.,RE00000002
MOV000687,It Happened Here,GB,2021-09-27,2021-10-21,GP0000020,1.75,Nor group determine news be catch audience little.,RE00000004
MOV000688,It's Such a Beautiful Day,GB,2021-03-19,2021-04-17,GP0000019,1.75,Meeting thing indicate player.,RE00000002
MOV000689,JCVD,GB,2021-02-09,2021-02-12,GP0000007,2.0,Water form forward some law owner.,RE00000003
MOV000690,Jaane Bhi Do Yaaro (1983),GB,2021-01-09,2021-02-03,GP0000003,1.5,Sure result range people what.,RE00000003
MOV000691,Jab We Met (2007),GB,2021-06-03,2021-06-19,GP0000017,1.75,Site man radio maybe college.,RE00000002
MOV000692,Jack Brooks Monster Slayer,GB,2021-02-28,2021-03-28,GP0000016,1.75,Fund sister consumer.,RE00000004
MOV000693,Jack Ryan: Shadow Recruit,GB,2021-09-12,2021-10-05,GP0000012,2.0,Fill billion positive director everything store go region.,RE00000001
MOV000694,Jackie,GB,2021-01-18,2021-02-02,GP0000024,1.75,Religious wonder campaign analysis raise.,RE00000001
MOV000695,Jackie Brown,GB,2021-03-20,2021-03-30,GP0000010,1.5,Teacher pass morning career trouble minute some.,RE00000001
MOV000696,Jacob's Ladder,GB,2021-01-23,2021-02-20,GP0000015,2.0,Doctor town agree own control.,RE00000002
MOV000697,Jagte Raho (1956),GB,2021-08-20,2021-09-14,GP0000012,1.75,News sell film for life.,RE00000003
MOV000698,Jaws (Series),GB,2021-07-25,2021-08-03,GP0000009,1.5,Within price fill morning yourself several might.,RE00000004
MOV000699,Jennifer's Body,GB,2021-07-24,2021-08-06,GP0000007,2.0,See piece thing control address modern.,RE00000001
MOV000700,"Jerk, The",GB,2021-10-19,2021-11-09,GP0000023,1.0,Ten value fly beyond affect should.,RE00000004
MOV000701,Jesus Camp,GB,2021-08-26,2021-08-26,GP0000018,1.0,Study me reason animal successful.,RE00000003
MOV000702,Jewel Thief (1967),GB,2021-09-09,2021-10-05,GP0000004,1.75,Job argue yard.,RE00000001
MOV000703,Jigsaw,GB,2021-06-07,2021-06-12,GP0000016,2.0,Military science throw activity discussion.,RE00000004
MOV000704,Jim and Andy: The Great Beyond,GB,2021-06-27,2021-07-11,GP0000017,1.0,Push anyone second region card single.,RE00000002
MOV000705,Jodhaa Akbar (2008),GB,2021-07-25,2021-08-08,GP0000009,2.0,Argue effect outside imagine.,RE00000001
MOV000706,Jodorowsky's Dune,GB,2021-04-02,2021-04-08,GP0000006,1.75,Morning hundred soon open into.,RE00000002
MOV000707,Joe,GB,2021-10-19,2021-11-13,GP0000015,1.0,Miss international machine amount have.,RE00000002
MOV000708,John Carpenter's Vampires,GB,2021-10-03,2021-10-10,GP0000004,1.5,Grow care determine event option issue quickly.,RE00000004
MOV000709,John Dies at the End,GB,2021-07-16,2021-08-07,GP0000008,1.75,Training radio loss yourself.,RE00000001
MOV000710,John Wick,GB,2021-06-21,2021-06-22,GP0000020,1.75,Sort center form especially.,RE00000002
MOV000711,Jonestown,GB,2021-11-29,2021-12-24,GP0000009,1.0,Partner ask writer Congress crime political compare.,RE00000003
MOV000712,Joy Ride,GB,2021-04-18,2021-04-19,GP0000016,1.0,Site camera long.,RE00000001
MOV000713,Julien Donkey-Boy,GB,2021-07-16,2021-08-07,GP0000013,1.0,Front remember civil friend table information.,RE00000001
MOV000714,Jupiter Ascending,GB,2021-04-24,2021-05-19,GP0000012,1.75,Financial author black edge standard condition let just.,RE00000003
MOV000715,Jurassic Park,GB,2021-07-05,2021-07-16,GP0000016,1.75,Company cover letter animal build.,RE00000003
MOV000716,K-PAX,GB,2021-06-28,2021-07-23,GP0000023,2.0,Design against head nothing one.,RE00000003
MOV000717,Kaagaz Ke Phool (1959),GB,2021-11-19,2021-12-11,GP0000013,2.0,Science stock mind bar.,RE00000004
MOV000718,Kaala Patthar (1979),GB,2021-04-26,2021-05-04,GP0000025,2.0,Yourself public arm.,RE00000004
MOV000719,Kabhi Khushi Kabhie Gham (2001),GB,2021-03-16,2021-03-26,GP0000017,1.75,Current determine newspaper start reveal share these.,RE00000001
MOV000720,Kabhie Kabhie (1976),GB,2021-05-30,2021-06-05,GP0000020,1.0,Machine research past early.,RE00000002
MOV000721,Kahaani (2012),GB,2021-06-15,2021-07-01,GP0000008,1.75,Start instead store two wrong certainly tend.,RE00000003
MOV000722,Kajillionaire,GB,2021-10-26,2021-10-28,GP0000009,1.5,Available provide tough home factor officer.,RE00000004
MOV000723,Kati Patang (1970),GB,2021-08-14,2021-08-20,GP0000013,1.75,Professional offer policy city take site bar.,RE00000002
MOV000724,Keep An Eye Out,GB,2021-04-08,2021-04-20,GP0000006,1.5,Point dinner billion admit second never.,RE00000001
MOV000725,Ken Park,GB,2021-11-25,2021-12-08,GP0000014,2.0,Himself their yourself cut buy call.,RE00000003
MOV000726,Khakee (2004),GB,2021-05-19,2021-06-15,GP0000022,1.0,Generation author attention political travel.,RE00000003
MOV000727,Kids,GB,2021-05-02,2021-05-26,GP0000001,1.75,Media wide mind alone life million west find.,RE00000001
MOV000728,Kiki's Delivery Service,GB,2021-05-01,2021-05-14,GP0000001,1.0,Painting put fear surface world.,RE00000001
MOV000729,Kill Bill,GB,2021-12-06,2021-12-19,GP0000011,1.0,Fish wide consumer reason.,RE00000003
MOV000730,Kill Bill 2,GB,2021-10-15,2021-10-20,GP0000006,1.5,Art color agree drug.,RE00000004
MOV000731,Kill List,GB,2021-09-30,2021-10-12,GP0000024,1.0,After training court thus north participant.,RE00000002
MOV000732,Killer Klowns from Outer Space,GB,2021-09-09,2021-09-24,GP0000023,1.5,Else course clearly war guess ahead.,RE00000001
MOV000733,Killing Bono,GB,2021-04-03,2021-05-02,GP0000007,1.75,Just training chair stuff.,RE00000003
MOV000734,"Killing Room, The",GB,2021-11-27,2021-12-17,GP0000004,1.75,Well remain need car.,RE00000004
MOV000735,"Killing of a Sacred Deer, The",GB,2021-07-09,2021-07-15,GP0000009,2.0,Society learn although in remember soldier likely.,RE00000002
MOV000736,"Killing, The",GB,2021-10-27,2021-11-23,GP0000008,1.5,Send four radio candidate collection democratic social.,RE00000003
MOV000737,Kindergarten Cop,GB,2021-05-20,2021-06-09,GP0000002,1.5,However wonder cost senior success.,RE00000004
MOV000738,"King of Kong, The",GB,2021-09-11,2021-10-07,GP0000015,2.0,Most less because rock dog effect.,RE00000001
MOV000739,King of New York,GB,2021-03-02,2021-03-28,GP0000022,1.75,Fire produce film morning center speech.,RE00000001
MOV000740,Kinky Boots,GB,2021-10-06,2021-10-26,GP0000016,2.0,Something both piece appear physical floor benefit.,RE00000004
MOV000741,"Kiss Kiss, Bang Bang",GB,2021-06-04,2021-07-03,GP0000020,1.5,Hour there look memory.,RE00000002
MOV000742,Klown,GB,2021-04-03,2021-04-08,GP0000020,2.0,Save Democrat never for yes executive there.,RE00000004
MOV000743,Knives Out,GB,2021-06-11,2021-07-01,GP0000002,1.0,Industry wear condition house detail part suggest.,RE00000003
MOV000744,Knock Knock,GB,2021-05-08,2021-06-03,GP0000005,1.75,Red college born together.,RE00000003
MOV000745,Krampus,GB,2021-07-14,2021-07-20,GP0000024,2.0,Dream throw size watch charge assume vote majority.,RE00000001
MOV000746,Kubo and the Two Strings,GB,2021-11-14,2021-11-16,GP0000021,1.5,Science quality design girl.,RE00000004
MOV000747,Kuch Kuch Hota Hai (1998),GB,2021-04-30,2021-05-09,GP0000011,2.0,Interest finally call fall phone imagine.,RE00000003
MOV000748,"Kumiko, The Treasure Hunter",GB,2021-03-10,2021-03-22,GP0000023,1.75,Simply game court security.,RE00000002
MOV000749,Kuso,GB,2021-09-27,2021-10-01,GP0000002,1.0,Different treatment lot along.,RE00000004
MOV000750,L'Atalante,GB,2021-01-19,2021-02-09,GP0000010,1.75,Heavy dog color such.,RE00000001
MOV000751,L.A. Story,GB,2021-01-22,2021-01-26,GP0000002,2.0,Forward quickly gun necessary table.,RE00000004
MOV000752,LA Confidential,GB,2021-05-22,2021-05-22,GP0000024,1.0,Smile scientist line window ok.,RE00000001
MOV000753,La Grande Bouffe,GB,2021-06-04,2021-06-07,GP0000024,1.0,List describe art chance vote Republican ability.,RE00000002
MOV000754,"Ladykillers, The",GB,2021-12-02,2021-12-30,GP0000004,1.0,President other cell many show air analysis.,RE00000004
MOV000755,Lagaan (2001),GB,2021-09-11,2021-09-19,GP0000003,1.0,Feel environmental leave need enjoy film worker before.,RE00000001
MOV000756,Lage Raho Munna Bhai (2006),GB,2021-08-17,2021-09-09,GP0000011,1.75,Close school pull cut.,RE00000001
MOV000757,Last Action Hero,GB,2021-08-07,2021-08-13,GP0000011,1.0,Foreign deal last consumer.,RE00000001
MOV000758,"Last Black Man in San Francisco, The",GB,2021-01-30,2021-01-30,GP0000022,1.75,Visit finish learn who attack nor life.,RE00000003
MOV000759,"Last Exorcism, The",GB,2021-06-04,2021-06-05,GP0000022,2.0,Land beat past front attention attention between.,RE00000003
MOV000760,"Last Man on Earth, The",GB,2021-09-24,2021-10-22,GP0000009,1.0,Amount tonight tend require.,RE00000004
MOV000761,"Lawnmower Man, The",GB,2021-11-30,2021-12-17,GP0000022,2.0,Star just spend with improve individual.,RE00000003
MOV000762,League of Extraordinary Gentlemen,GB,2021-09-09,2021-09-26,GP0000010,1.5,Third can the.,RE00000004
MOV000763,Leave it to Beavers,GB,2021-05-16,2021-05-31,GP0000013,2.0,True course physical economic benefit.,RE00000004
MOV000764,"Ledge, The",GB,2021-03-05,2021-03-17,GP0000010,1.0,Certainly five chair produce western whom.,RE00000003
MOV000765,Legend,GB,2021-11-02,2021-11-02,GP0000012,1.75,Lay show camera others program.,RE00000004
MOV000766,"Lego Movie, The",GB,2021-07-07,2021-07-19,GP0000024,1.0,Product per gas.,RE00000004
MOV000767,Leprechaun (Series),GB,2021-10-24,2021-10-31,GP0000021,1.5,Position series conference maybe political hospital.,RE00000004
MOV000768,Let Me Make You a Martyr,GB,2021-06-05,2021-06-20,GP0000017,2.0,Development history necessary claim.,RE00000003
MOV000769,Let the Right One In,GB,2021-09-27,2021-10-13,GP0000009,1.75,Serve street either talk medical PM over.,RE00000004
MOV000770,"Libertine, The",GB,2021-06-14,2021-07-06,GP0000015,2.0,Clearly keep point forward century wear.,RE00000001
MOV000771,"Lighthouse, The",GB,2021-10-24,2021-11-06,GP0000017,2.0,Down morning write enjoy strong senior mouth.,RE00000002
MOV000772,"Limey, The",GB,2021-01-26,2021-01-26,GP0000008,1.5,Run all different yes.,RE00000002
MOV000773,"Lion King, The",GB,2021-02-24,2021-02-28,GP0000024,1.5,Service another send among hit market.,RE00000004
MOV000774,Little Monsters,GB,2021-11-22,2021-12-03,GP0000004,1.0,Particular necessary black situation public.,RE00000004
MOV000775,Little Nemo,GB,2021-06-08,2021-06-17,GP0000017,1.5,Reach above meet but.,RE00000004
MOV000776,"Little Princess, A",GB,2021-08-02,2021-08-10,GP0000021,1.75,Partner condition down according none.,RE00000002
MOV000777,"Little Shop of Horrors, The",GB,2021-04-24,2021-05-07,GP0000018,1.0,Within own moment history air piece eat up.,RE00000002
MOV000778,"Living Daylights, The",GB,2021-10-08,2021-11-06,GP0000019,1.75,Worry their us thing question crime.,RE00000003
MOV000779,Lo and Behold,GB,2021-03-12,2021-03-20,GP0000002,1.0,Win attack start let fish treat tree.,RE00000001
MOV000780,"Lobster, The",GB,2021-04-26,2021-05-23,GP0000016,1.75,Usually drug against opportunity dark floor standard.,RE00000001
MOV000781,Logan Lucky,GB,2021-06-15,2021-07-01,GP0000016,1.75,Listen probably light many smile main TV.,RE00000003
MOV000782,Logan's Run,GB,2021-05-14,2021-05-25,GP0000011,1.5,We rather within indeed investment.,RE00000003
MOV000783,Look,GB,2021-03-15,2021-03-19,GP0000025,1.0,Produce story what place girl three.,RE00000001
MOV000784,Looney Tunes: Back in Action,GB,2021-06-24,2021-07-13,GP0000019,1.5,Attention poor while social glass participant main.,RE00000002
MOV000785,Looper,GB,2021-09-03,2021-09-10,GP0000015,1.0,My drug prove catch make south along figure.,RE00000001
MOV000786,Loose Change,GB,2021-02-27,2021-03-19,GP0000002,2.0,These risk weight degree speech.,RE00000004
MOV000787,Lootera (2013),GB,2021-09-23,2021-10-14,GP0000008,1.0,Business writer audience bed actually.,RE00000003
MOV000788,Lord of War,GB,2021-06-25,2021-07-21,GP0000024,1.0,Country water product performance.,RE00000002
MOV000789,"Lords of Salem, The",GB,2021-02-15,2021-02-23,GP0000018,2.0,Plan there huge boy method form.,RE00000002
MOV000790,Lost Highway,GB,2021-01-16,2021-01-19,GP0000013,1.75,Force current where oil operation.,RE00000004
MOV000791,Lost in Translation,GB,2021-11-07,2021-11-09,GP0000025,1.5,Chance firm eight cultural guy pass.,RE00000003
MOV000792,Love,GB,2021-05-02,2021-05-28,GP0000012,1.0,Yeah fast music listen it.,RE00000002
MOV000793,"Love Witch, The",GB,2021-03-24,2021-04-07,GP0000004,2.0,Effect similar own probably.,RE00000001
MOV000794,"Loved Ones, The",GB,2021-06-22,2021-07-17,GP0000004,1.0,Able front development modern finally various.,RE00000004
MOV000795,"Lovely Bones, The",GB,2021-02-23,2021-03-07,GP0000021,1.5,Again decade lead edge the drug.,RE00000002
MOV000796,Lowlife,GB,2021-12-03,2021-12-12,GP0000013,2.0,Almost show really population good.,RE00000001
MOV000797,Lucifer Rising,GB,2021-04-03,2021-04-12,GP0000005,1.5,Floor kid lead call.,RE00000002
MOV000798,"Lure, The",GB,2021-02-07,2021-03-06,GP0000011,1.75,Unit bar to general how staff same.,RE00000002
MOV000799,M,GB,2021-12-08,2021-12-26,GP0000014,2.0,Challenge most stop different.,RE00000003
MOV000800,Machete,GB,2021-09-06,2021-09-24,GP0000005,2.0,Several test billion.,RE00000004
MOV000801,Machete Kills,GB,2021-11-21,2021-12-02,GP0000016,1.0,Product this draw instead begin any relate.,RE00000002
MOV000802,"Machine Girl, The",GB,2021-05-19,2021-05-31,GP0000021,1.75,Something from fine certainly hit onto.,RE00000004
MOV000803,"Machinist, The",GB,2021-03-24,2021-04-01,GP0000011,1.0,Could show road ok street look husband.,RE00000001
MOV000804,Mad Max: Fury Road,GB,2021-01-28,2021-02-06,GP0000018,1.0,Find measure may evidence.,RE00000001
MOV000805,Madhumati (1958),GB,2021-04-28,2021-05-23,GP0000009,1.75,Fly dog research design note different several.,RE00000001
MOV000806,Magic Magic,GB,2021-05-22,2021-05-30,GP0000021,1.75,Force onto glass me red TV decide.,RE00000003
MOV000807,Magic Mike,GB,2021-01-30,2021-02-11,GP0000003,1.5,Person beat wall own sign third Mr.,RE00000004
MOV000808,Magnolia,GB,2021-05-25,2021-05-31,GP0000004,1.0,Man create natural drive information contain.,RE00000001
MOV000809,Main Hoon Na (2004),GB,2021-01-11,2021-01-26,GP0000021,1.75,Any theory nearly sit total culture picture.,RE00000001
MOV000810,Maine Pyar Kiya (1989),GB,2021-08-03,2021-08-31,GP0000021,1.0,Word market majority open.,RE00000004
MOV000811,Malignant,GB,2021-10-25,2021-10-27,GP0000006,1.5,Exist cover kitchen or boy finally.,RE00000001
MOV000812,"Man From Earth, The",GB,2021-01-16,2021-02-06,GP0000023,1.5,Cold bed me.,RE00000004
MOV000813,"Man Who Killed Don Quixote, The",GB,2021-12-07,2022-01-04,GP0000009,1.75,In ever statement argue.,RE00000003
MOV000814,"Man Who Wasn’t There, The",GB,2021-02-05,2021-03-01,GP0000022,1.5,Door church safe recent cup message.,RE00000003
MOV000815,Man on Fire,GB,2021-05-26,2021-06-13,GP0000025,1.0,Wish their deep.,RE00000003
MOV000816,Man on Wire,GB,2021-10-17,2021-11-09,GP0000004,1.75,Seat set buy nor cold light top.,RE00000001
MOV000817,"Man with the Golden Arm, The",GB,2021-10-27,2021-11-11,GP0000009,1.0,You network recent not most.,RE00000001
MOV000818,"Man with the Iron Fists, The",GB,2021-05-13,2021-05-21,GP0000022,1.5,Family whose make stay table may nice.,RE00000002
MOV000819,Mandy,GB,2021-08-23,2021-09-10,GP0000021,1.75,General situation final writer effort.,RE00000003
MOV000820,Manhattan,GB,2021-12-01,2021-12-28,GP0000021,1.0,Alone second deal.,RE00000001
MOV000821,Manhattan Murder Mystery,GB,2021-10-26,2021-11-07,GP0000013,1.75,Pm wait fly to do interesting fear.,RE00000002
MOV000822,Manhunter,GB,2021-07-15,2021-07-29,GP0000005,2.0,Report people light human.,RE00000004
MOV000823,Maniac,GB,2021-08-12,2021-08-15,GP0000022,1.5,Catch cup let card help its.,RE00000003
MOV000824,Maniac Cop (Series),GB,2021-07-11,2021-08-03,GP0000021,1.0,Any energy yet what personal visit crime.,RE00000002
MOV000825,Mank,GB,2021-10-21,2021-10-21,GP0000005,1.5,Be happy think.,RE00000003
MOV000826,Maps to the Stars,GB,2021-03-27,2021-04-12,GP0000002,1.5,Leader generation grow participant maybe.,RE00000003
MOV000827,Marihuana,GB,2021-07-01,2021-07-17,GP0000023,1.5,Wear risk water around himself.,RE00000001
MOV000828,Mars Attacks,GB,2021-03-19,2021-03-19,GP0000010,1.0,Believe couple place.,RE00000004
MOV000829,Mars Needs Women,GB,2021-06-18,2021-06-26,GP0000020,2.0,Your contain community most partner ability respond enough.,RE00000001
MOV000830,"Martian, The",GB,2021-02-28,2021-03-12,GP0000001,2.0,Section perhaps ok product economic science.,RE00000004
MOV000831,Martyrs,GB,2021-04-07,2021-04-14,GP0000018,1.75,Off among plan happy.,RE00000001
MOV000832,Mary and Max,GB,2021-05-13,2021-06-08,GP0000025,1.75,Wife camera site.,RE00000001
MOV000833,"Master, The",GB,2021-11-05,2021-11-18,GP0000007,1.75,Agreement cover American four rich authority firm brother.,RE00000001
MOV000834,Matador,GB,2021-03-23,2021-03-24,GP0000013,1.75,Anything summer entire remain trial provide.,RE00000004
MOV000835,"Matador, The",GB,2021-08-11,2021-09-04,GP0000005,1.0,Word choice might toward center.,RE00000002
MOV000836,Matinee,GB,2021-02-10,2021-03-05,GP0000009,1.0,Draw could heavy reality.,RE00000004
MOV000837,"Matrix, The",GB,2021-09-17,2021-09-30,GP0000008,2.0,Manager brother technology serious place event.,RE00000001
MOV000838,May,GB,2021-04-16,2021-04-19,GP0000007,1.0,Despite serve note through pick shoulder garden.,RE00000004
MOV000839,Mayhem,GB,2021-05-10,2021-05-20,GP0000010,1.75,Me pull enter leave central wide leader kitchen.,RE00000003
MOV000840,"McVeigh Tapes, The",GB,2021-04-15,2021-04-29,GP0000004,1.75,Project hour big upon onto.,RE00000003
MOV000841,Me and You and Everyone We Know,GB,2021-06-21,2021-06-28,GP0000001,1.5,Must feel significant upon material boy.,RE00000004
MOV000842,Mean Creek,GB,2021-09-02,2021-09-23,GP0000005,1.75,Serve have scene change serious.,RE00000001
MOV000843,Mean Girls,GB,2021-01-18,2021-02-13,GP0000009,1.5,White particularly drop kid beautiful.,RE00000002
MOV000844,Meet the Feebles,GB,2021-09-18,2021-10-02,GP0000018,2.0,Another ten seek physical management group present network.,RE00000002
MOV000845,Melancholia,GB,2021-04-20,2021-05-07,GP0000005,2.0,Team describe mouth director myself.,RE00000002
MOV000846,Melinda and Melinda,GB,2021-02-24,2021-03-01,GP0000018,1.0,How less coach thousand.,RE00000002
MOV000847,Memento,GB,2021-03-27,2021-03-31,GP0000003,1.5,Account enter commercial either pull yourself travel result.,RE00000002
MOV000848,Memoirs of an Invisible Man,GB,2021-10-19,2021-10-23,GP0000022,1.0,Modern step sign our military form parent.,RE00000003
MOV000849,Memories of Murder,GB,2021-11-23,2021-11-23,GP0000011,1.0,Your difference might magazine local government test.,RE00000004
MOV000850,Mera Naam Joker (1970),GB,2021-11-05,2021-11-09,GP0000008,1.75,Conference early represent phone certain.,RE00000004
MOV000851,Metropolitan,GB,2021-02-10,2021-03-06,GP0000006,1.0,Final recognize truth.,RE00000002
MOV000852,Michael Moore Hates America,GB,2021-05-01,2021-05-19,GP0000003,2.0,Real order yet ago material late.,RE00000002
MOV000853,Midsommar,GB,2021-08-24,2021-09-02,GP0000014,1.0,Off character natural care future send identify.,RE00000001
MOV000854,"Million Dollar Hotel, The",GB,2021-02-25,2021-03-13,GP0000017,2.0,Since ready avoid.,RE00000004
MOV000855,MirrorMask,GB,2021-11-14,2021-11-18,GP0000010,1.75,Than sing well.,RE00000004
MOV000856,Misery,GB,2021-07-08,2021-07-29,GP0000005,1.75,Life sure visit miss food soldier.,RE00000001
MOV000857,"Mist, The",GB,2021-01-14,2021-02-05,GP0000017,1.5,Defense I discover list.,RE00000001
MOV000858,Mister Frost,GB,2021-11-28,2021-12-08,GP0000010,1.5,Idea walk federal dinner even order rich mother.,RE00000003
MOV000859,Mister Lonely,GB,2021-01-31,2021-02-04,GP0000006,1.5,Somebody by window mention evening player foreign.,RE00000003
MOV000860,Moebius,GB,2021-08-28,2021-09-19,GP0000020,1.0,Accept half group yard represent professor yes.,RE00000002
MOV000861,Moneyball,GB,2021-05-31,2021-06-23,GP0000002,1.0,Population their old pressure short.,RE00000002
MOV000862,Monster Man,GB,2021-03-28,2021-04-21,GP0000019,1.75,Church allow mention market material between for.,RE00000004
MOV000863,"Monster Squad, The",GB,2021-10-09,2021-10-20,GP0000017,1.0,Color ago show take stop before.,RE00000002
MOV000864,Monster's Ball,GB,2021-03-25,2021-04-16,GP0000013,1.75,Upon wonder three lose lay heart.,RE00000001
MOV000865,Monsters,GB,2021-11-21,2021-11-30,GP0000011,1.5,Majority threat continue allow benefit.,RE00000004
MOV000866,Moon,GB,2021-11-07,2021-11-17,GP0000012,1.0,But inside present.,RE00000001
MOV000867,Moonlight,GB,2021-12-01,2021-12-13,GP0000014,1.5,Appear various suddenly response age like late turn.,RE00000001
MOV000868,Moonraker,GB,2021-05-01,2021-05-30,GP0000016,1.0,Cultural and interesting establish.,RE00000002
MOV000869,Moonrise Kingdom,GB,2021-07-16,2021-07-25,GP0000008,1.5,Team ability tough tonight inside husband tax.,RE00000004
MOV000870,Mother,GB,2021-09-18,2021-10-13,GP0000023,1.75,Center involve four interest education necessary.,RE00000003
MOV000871,Mother India (1957),GB,2021-08-26,2021-09-05,GP0000010,1.75,Popular represent product six happen why offer.,RE00000001
MOV000872,Mother!,GB,2021-07-05,2021-07-15,GP0000020,1.5,Nature include administration name lot.,RE00000004
MOV000873,Mr & Mrs ’55 (1955),GB,2021-03-22,2021-04-16,GP0000025,2.0,Open argue bank official.,RE00000003
MOV000874,Mr India (1987),GB,2021-09-10,2021-09-28,GP0000013,1.75,Message high garden carry test.,RE00000004
MOV000875,Ms. 45,GB,2021-02-04,2021-02-07,GP0000001,1.75,Side cause actually federal director.,RE00000001
MOV000876,Mughal-e-Azam (1960),GB,2021-02-26,2021-03-26,GP0000025,2.0,Better environmental study go.,RE00000003
MOV000877,Mujhse Dosti Karoge! (2002),GB,2021-11-06,2021-11-19,GP0000013,1.75,Baby newspaper election local common yes scientist.,RE00000002
MOV000878,Mulberry Street,GB,2021-04-08,2021-05-02,GP0000024,1.5,Black also perform production ask.,RE00000001
MOV000879,Mulholland Drive,GB,2021-12-06,2021-12-28,GP0000016,2.0,Low budget its focus guy factor pressure.,RE00000002
MOV000880,"Mummy, The",GB,2021-06-13,2021-06-20,GP0000018,1.0,Action room task owner run cover will.,RE00000004
MOV000881,"Muppet Movie, The",GB,2021-04-24,2021-05-09,GP0000009,1.0,Occur pass trade happy recognize.,RE00000001
MOV000882,Murder By Death,GB,2021-03-19,2021-03-23,GP0000008,1.5,Number raise space magazine decide.,RE00000002
MOV000883,Murderball,GB,2021-03-22,2021-03-26,GP0000025,1.5,Nation again generation can.,RE00000004
MOV000884,My Bloody Valentine,GB,2021-11-01,2021-11-08,GP0000019,1.75,Own here unit art window stop safe wall.,RE00000002
MOV000885,My Dinner with Andre,GB,2021-08-25,2021-09-19,GP0000024,1.5,Force capital beat quickly heart.,RE00000004
MOV000886,My Life as a Zucchini,GB,2021-10-23,2021-11-02,GP0000017,2.0,Two owner operation factor authority sister.,RE00000001
MOV000887,My Neighbor Totoro,GB,2021-08-05,2021-09-03,GP0000007,1.0,Onto appear story speak season war site child.,RE00000002
MOV000888,"My Son, My Son What Have Ye Done",GB,2021-11-16,2021-12-03,GP0000006,1.0,Mr test ready interesting more number more describe.,RE00000004
MOV000889,Mysterious Skin,GB,2021-01-21,2021-02-05,GP0000014,1.75,Himself dinner agent year.,RE00000001
MOV000890,Naked Lunch,GB,2021-02-02,2021-02-19,GP0000024,1.0,Perhaps pay leg individual newspaper gun system.,RE00000003
MOV000891,Naseeb (1981),GB,2021-09-16,2021-10-09,GP0000025,2.0,Realize pretty determine job.,RE00000001
MOV000892,Nashville,GB,2021-02-24,2021-03-19,GP0000018,2.0,Research property record me meeting.,RE00000001
MOV000893,Natural Born Killers,GB,2021-11-07,2021-11-20,GP0000014,1.5,Themselves we major special pick possible whose break.,RE00000004
MOV000894,Near Dark,GB,2021-07-29,2021-08-03,GP0000025,1.0,Left apply close public themselves new several.,RE00000003
MOV000895,"Neon Demon, The",GB,2021-09-13,2021-09-22,GP0000013,2.0,Miss weight stage reality often plan.,RE00000002
MOV000896,Network,GB,2021-08-16,2021-08-18,GP0000010,1.0,Scientist tonight force apply position show.,RE00000003
MOV000897,New Jack City,GB,2021-03-31,2021-04-06,GP0000023,1.75,Career place already may performance campaign tell.,RE00000004
MOV000898,Next,GB,2021-01-21,2021-01-31,GP0000024,1.5,Enjoy part democratic already among walk mention.,RE00000001
MOV000899,Nice Dreams,GB,2021-04-29,2021-05-19,GP0000022,2.0,Direction stay order pattern bank age movie.,RE00000002
MOV000900,"Nice Guys, The",GB,2021-07-25,2021-08-05,GP0000003,2.0,Positive low trade situation college.,RE00000001
MOV000901,Night at the Golden Eagle,GB,2021-04-04,2021-04-25,GP0000002,1.5,Forget modern floor nor.,RE00000004
MOV000902,"Night in Casablanca, A",GB,2021-01-28,2021-02-02,GP0000018,1.5,Six six speak stay prepare late.,RE00000002
MOV000903,Night of the Comet,GB,2021-04-13,2021-04-29,GP0000019,1.5,Trial live within store.,RE00000001
MOV000904,Night of the Creeps,GB,2021-11-08,2021-11-08,GP0000015,1.5,Skin face interview north son everyone.,RE00000003
