id,nombre,idioma,fecha_adquisicion,fecha_estreno,genero_id,duracion_h,resena,nivelpublico_id
MOV000227,Charley Varrick,GB,2021-11-26,2021-12-18,GP0000023,1.75,Radio wife popular president.,RE00000004
MOV000228,Chasing Amy,GB,2021-11-10,2021-11-18,GP0000004,2.0,Probably require particularly.,RE00000004
MOV000229,Chelsea Girls,GB,2021-05-05,2021-05-24,GP0000010,1.0,Show technology difficult.,RE00000003
MOV000230,Chhoti Si Baat (1975),GB,2021-08-23,2021-08-29,GP0000023,2.0,Past card let.,RE00000001
MOV000231,Child's Play (Chucky Series),GB,2021-09-12,2021-09-13,GP0000024,2.0,Growth different unit.,RE00000004
MOV000232,Children of Men,GB,2021-10-10,2021-10-15,GP0000012,1.5,Continue power character offer.,RE00000003
MOV000233,Children of the Corn (Series),GB,2021-01-17,2021-01-22,GP0000023,1.0,Western here avoid camera charge blood.,RE00000001
MOV000234,"Children, The",GB,2021-02-23,2021-02-24,GP0000003,1.75,Then similar play you age old.,RE00000003
MOV000235,Chillerama,GB,2021-02-21,2021-03-14,GP0000011,1.5,Year federal international rest provide.,RE00000003
MOV000236,Chinatown,GB,2021-08-18,2021-09-11,GP0000024,1.75,Suggest write turn future value.,RE00000003
MOV000237,Chopping Mall,GB,2021-11-24,2021-12-08,GP0000001,1.75,Look season month focus check civil behind.,RE00000004
MOV000238,Christine,GB,2021-11-07,2021-12-05,GP0000001,1.5,Become sound believe knowledge.,RE00000001
MOV000239,Christmas on Mars,GB,2021-10-28,2021-11-21,GP0000023,2.0,Pass back tax how claim.,RE00000002
MOV000240,Chronicle,GB,2021-12-04,2021-12-17,GP0000014,1.5,Dark push all area good consider recognize.,RE00000002
MOV000241,Chungking Express,GB,2021-03-20,2021-04-15,GP0000010,2.0,Large never investment really power city.,RE00000002
MOV000242,Citizen Kane,GB,2021-04-28,2021-05-10,GP0000024,1.0,Maybe beyond budget eye animal month news probably.,RE00000001
MOV000243,Citizenfour,GB,2021-01-11,2021-02-04,GP0000010,1.5,Professional bar prove issue ground.,RE00000004
MOV000244,City of the Living Dead,GB,2021-07-25,2021-07-27,GP0000001,1.5,Data race spend myself eat lose.,RE00000002
MOV000245,Class of 1984,GB,2021-01-20,2021-01-28,GP0000001,1.5,Total body how time someone mean.,RE00000004
MOV000246,Class of 1999,GB,2021-05-11,2021-06-03,GP0000002,1.0,Our place beyond worry kind local course.,RE00000004
MOV000247,Clear and Present Danger,GB,2021-04-06,2021-05-05,GP0000022,1.5,Billion top before think care born his.,RE00000004
MOV000248,Clerks,GB,2021-07-17,2021-07-23,GP0000001,1.75,Provide anyone democratic.,RE00000003
MOV000249,Climax,GB,2021-06-22,2021-07-18,GP0000004,1.0,Should require fear half skill.,RE00000004
MOV000250,Clockers,GB,2021-04-02,2021-04-15,GP0000023,2.0,Offer six responsibility participant those ahead.,RE00000001
MOV000251,"Clockwork Orange, A",GB,2021-05-24,2021-05-28,GP0000002,1.75,Detail feeling member.,RE00000002
MOV000252,Closer,GB,2021-08-05,2021-08-13,GP0000018,1.75,Matter ability significant strong rise per relate.,RE00000003
MOV000253,Cloud Atlas,GB,2021-10-29,2021-11-24,GP0000022,1.0,Result number debate finally practice something your.,RE00000001
MOV000254,Cloverfield,GB,2021-08-04,2021-08-24,GP0000019,2.0,Catch full life oil traditional half other.,RE00000004
MOV000255,Clown,GB,2021-11-30,2021-12-09,GP0000012,1.75,Live Congress song picture PM traditional.,RE00000001
MOV000256,Clue,GB,2021-07-21,2021-08-19,GP0000020,1.75,Science spend poor pretty.,RE00000003
MOV000257,Cockfighter,GB,2021-02-18,2021-02-18,GP0000021,1.0,Present physical process major she.,RE00000002
MOV000258,Coffy,GB,2021-07-28,2021-08-19,GP0000020,1.0,Service again room value network.,RE00000001
MOV000259,Coherence,GB,2021-11-17,2021-11-30,GP0000011,1.0,Policy pressure view direction.,RE00000003
MOV000260,Cold Fish,GB,2021-11-18,2021-12-17,GP0000021,1.0,Sister feeling five.,RE00000002
MOV000261,Cold Souls,GB,2021-11-22,2021-12-11,GP0000011,1.75,Democrat hotel wish both indeed simple response.,RE00000003
MOV000262,Cold in July,GB,2021-08-04,2021-08-27,GP0000014,2.0,Large project kid.,RE00000003
MOV000263,Collateral,GB,2021-05-28,2021-06-18,GP0000007,1.75,Add owner account.,RE00000001
MOV000264,Color Out of Space,GB,2021-09-03,2021-09-16,GP0000016,2.0,Meeting certain election little meeting task card.,RE00000003
MOV000265,Colossal,GB,2021-11-27,2021-12-26,GP0000025,1.5,Cause then fear determine this.,RE00000003
MOV000266,Colossus: The Forbin Project,GB,2021-03-12,2021-03-12,GP0000023,1.0,Baby address class nation these base.,RE00000002
MOV000267,"Company Men, The",GB,2021-03-27,2021-04-09,GP0000023,1.5,Show draw central daughter.,RE00000003
MOV000268,Compliance,GB,2021-06-02,2021-06-27,GP0000018,1.5,Experience most consumer lot church measure market.,RE00000004
MOV000269,Computer Chess,GB,2021-06-20,2021-06-25,GP0000018,2.0,City exactly treatment expert recently score like writer.,RE00000001
MOV000270,Conan the Barbarian,GB,2021-02-11,2021-03-01,GP0000005,1.75,Note speech sister notice different audience final Democrat.,RE00000003
MOV000271,Confessions of a Dangerous Mind,GB,2021-11-16,2021-11-18,GP0000019,1.75,Also artist hope describe reduce above.,RE00000004
MOV000272,"Congress, The",GB,2021-09-16,2021-10-04,GP0000011,2.0,Fund better simple paper save tree.,RE00000001
MOV000273,Constantine,GB,2021-11-06,2021-11-17,GP0000022,1.0,Political well leader wear create manage.,RE00000001
MOV000274,Contact,GB,2021-02-10,2021-02-21,GP0000022,2.0,Clear positive yes at.,RE00000004
MOV000275,Contagion,GB,2021-01-15,2021-02-09,GP0000021,2.0,Simply guy theory may different story charge.,RE00000004
MOV000276,"Conversation, The",GB,2021-11-21,2021-11-22,GP0000003,1.0,Record anything particularly crime arrive.,RE00000001
MOV000277,Cooties,GB,2021-02-06,2021-03-07,GP0000008,1.5,Blood Congress more.,RE00000004
MOV000278,Cop Car,GB,2021-09-10,2021-09-11,GP0000002,1.0,Catch already community rich situation.,RE00000002
MOV000279,Coraline,GB,2021-05-28,2021-06-02,GP0000007,1.75,Economy focus open poor out task PM.,RE00000002
MOV000280,Corpse Bride,GB,2021-02-05,2021-02-19,GP0000003,2.0,Reach per explain.,RE00000003
MOV000281,Cosmopolis,GB,2021-05-24,2021-06-07,GP0000006,1.75,Represent among raise green debate.,RE00000004
MOV000282,"Cottage, The",GB,2021-05-19,2021-05-24,GP0000004,1.0,Card either question stuff magazine we million.,RE00000003
MOV000283,"Craft, The",GB,2021-09-30,2021-10-23,GP0000017,1.75,Station society fill reduce.,RE00000003
MOV000284,Crank,GB,2021-11-29,2021-12-18,GP0000007,1.75,Watch raise effort someone.,RE00000003
MOV000285,Crank 2: High Voltage,GB,2021-09-28,2021-10-05,GP0000023,1.5,Report director reveal hear stand million.,RE00000004
MOV000286,Crash,GB,2021-04-25,2021-05-02,GP0000001,2.0,Participant body for hear.,RE00000003
MOV000287,Crawl,GB,2021-06-04,2021-06-09,GP0000002,2.0,Strong contain task include among every plan task.,RE00000004
MOV000288,Creep,GB,2021-05-26,2021-05-26,GP0000005,1.0,Scene son field tell whole.,RE00000004
MOV000289,Creepshow,GB,2021-07-11,2021-07-15,GP0000015,1.5,Six be training treat.,RE00000002
MOV000290,Crimes and Misdemeanors,GB,2021-02-19,2021-02-20,GP0000014,1.0,Finish wide how forget prepare after.,RE00000004
MOV000291,Criminal Lovers,GB,2021-11-12,2021-11-28,GP0000013,1.75,Environmental trade scene against so fund manager.,RE00000002
MOV000292,Crimson Peak,GB,2021-02-26,2021-03-18,GP0000012,1.5,Dog economy politics type travel book assume budget.,RE00000002
MOV000293,Critters (Series),GB,2021-05-10,2021-05-26,GP0000020,1.0,Physical magazine best customer capital change nor.,RE00000003
MOV000294,Cronos,GB,2021-10-09,2021-10-10,GP0000002,1.0,By dark network such leg window eye.,RE00000004
MOV000295,Crooklyn,GB,2021-05-20,2021-06-06,GP0000025,2.0,Race election memory how.,RE00000001
MOV000296,Cross of Iron,GB,2021-10-30,2021-11-24,GP0000015,2.0,Building improve run.,RE00000004
MOV000297,"Crow, The",GB,2021-11-09,2021-12-01,GP0000001,1.0,Move also those worry culture organization idea.,RE00000001
MOV000298,Cry-Baby,GB,2021-06-01,2021-06-29,GP0000002,1.5,Wall worry site race citizen star.,RE00000001
MOV000299,Cube,GB,2021-03-18,2021-04-15,GP0000014,1.5,Old teacher sport floor now young.,RE00000004
MOV000300,Cult of Chucky,GB,2021-02-20,2021-03-01,GP0000008,2.0,Expect natural eat cell popular.,RE00000001
MOV000301,Cure,GB,2021-04-29,2021-05-07,GP0000025,2.0,House interest together Mr Mrs itself.,RE00000002
MOV000302,"Curious Case of Benjamin Button, The",GB,2021-08-15,2021-08-15,GP0000011,1.75,Miss clearly news Mrs.,RE00000001
MOV000303,Curse of Chucky,GB,2021-07-22,2021-07-29,GP0000007,1.0,Arrive affect accept prepare.,RE00000002
MOV000304,Cuties,GB,2021-01-09,2021-01-26,GP0000016,1.0,Main major decide recently become somebody.,RE00000001
MOV000305,DOA: Dead or Alive,GB,2021-11-06,2021-11-07,GP0000001,1.75,Summer the even interesting growth development themselves wind.,RE00000002
MOV000306,Da 5 Bloods,GB,2021-06-12,2021-07-01,GP0000012,1.5,Dog with sit five state.,RE00000001
MOV000307,Dabangg (2010),GB,2021-09-08,2021-09-29,GP0000024,1.75,Congress again hundred quite research.,RE00000001
MOV000308,Dagon,GB,2021-08-10,2021-08-16,GP0000007,1.5,I service full statement.,RE00000001
MOV000309,Daisies,GB,2021-10-15,2021-10-31,GP0000013,1.75,Pass than matter development eight everyone.,RE00000001
MOV000310,Dancer in the Dark,GB,2021-05-18,2021-06-13,GP0000009,1.5,Word maintain section mission red.,RE00000004
MOV000311,"Dangerous Method, A",GB,2021-11-15,2021-11-17,GP0000022,1.75,Off trade first operation.,RE00000004
MOV000312,Dark City,GB,2021-01-18,2021-02-13,GP0000013,1.5,Before his appear guy billion.,RE00000004
MOV000313,"Dark Crystal, The",GB,2021-12-10,2022-01-08,GP0000010,1.0,True although provide how.,RE00000002
MOV000314,Dark Horse,GB,2021-11-07,2021-11-14,GP0000020,1.0,Different water some leader spend ago democratic.,RE00000001
MOV000315,Dark Star,GB,2021-01-30,2021-02-03,GP0000005,1.0,Unit although close author next.,RE00000002
MOV000316,Darkon,GB,2021-06-01,2021-06-27,GP0000020,2.0,Order news sell bed thought side quality shake.,RE00000002
MOV000317,Dawn of the Dead,GB,2021-04-29,2021-05-27,GP0000024,1.75,Ok guy I mind positive.,RE00000004
MOV000318,"Day Reagan Was Shot, The",GB,2021-02-21,2021-02-21,GP0000010,1.5,Teacher product executive much home success player.,RE00000003
MOV000319,Dazed and Confused,GB,2021-04-09,2021-05-07,GP0000012,1.75,Stop order girl like space.,RE00000001
MOV000320,De-Lovely,GB,2021-03-28,2021-04-13,GP0000021,1.0,Seven policy suddenly land local.,RE00000003
MOV000321,Dead Man,GB,2021-06-24,2021-07-04,GP0000015,1.0,Market its level thing report religious mean day.,RE00000001
MOV000322,Dead Ringers,GB,2021-05-11,2021-05-16,GP0000009,1.0,Begin series tough receive natural establish again.,RE00000002
MOV000323,"Dead Zone, The",GB,2021-04-07,2021-04-22,GP0000018,1.5,Figure challenge fund fact cover together budget everybody.,RE00000003
MOV000324,Death Becomes Her,GB,2021-03-15,2021-04-02,GP0000015,1.75,Deep that price the call.,RE00000002
MOV000325,Death Race 2000,GB,2021-07-22,2021-08-05,GP0000024,1.75,Be treat memory.,RE00000002
MOV000326,Death of a President,GB,2021-09-06,2021-09-06,GP0000006,1.0,Yourself wait money your protect.,RE00000002
MOV000327,Death to Smoochy,GB,2021-09-07,2021-10-04,GP0000014,1.75,Question likely any situation theory.,RE00000002
MOV000328,Deep Red,GB,2021-03-08,2021-03-17,GP0000025,1.75,Around close inside.,RE00000003
MOV000329,Deep Rising,GB,2021-03-03,2021-03-09,GP0000003,1.5,Smile control require range population establish baby.,RE00000001
MOV000330,"Deer Hunter, The",GB,2021-05-22,2021-06-12,GP0000004,1.0,Thousand woman all with avoid security song sound.,RE00000004
MOV000331,Deerskin,GB,2021-10-01,2021-10-20,GP0000007,1.5,And including none try standard think close head.,RE00000004
MOV000332,Deewaar (1975),GB,2021-06-15,2021-06-21,GP0000011,2.0,Guy enough improve individual no yourself.,RE00000004
MOV000333,Delicatessen,GB,2021-05-18,2021-06-09,GP0000013,1.5,Something consider lot sense owner mind these.,RE00000004
MOV000334,Deliver Us From Evil,GB,2021-09-03,2021-09-28,GP0000011,1.75,Better necessary least travel good.,RE00000001
MOV000335,Deliverance,GB,2021-11-26,2021-12-20,GP0000021,1.0,Leg least there glass.,RE00000004
MOV000336,Dementia 13,GB,2021-07-04,2021-07-27,GP0000001,1.5,Or fly upon might street who beat.,RE00000002
MOV000337,Demolition Man,GB,2021-04-20,2021-05-03,GP0000001,1.75,Garden record technology expert time them find.,RE00000002
MOV000338,Demon Seed,GB,2021-04-29,2021-05-28,GP0000009,2.0,Wish before baby half hit brother.,RE00000004
MOV000339,Demonlover,GB,2021-09-02,2021-09-05,GP0000019,1.5,Item modern he.,RE00000003
MOV000340,"Dentist, The",GB,2021-08-29,2021-09-03,GP0000002,1.75,Education southern add two.,RE00000004
MOV000341,"Departed, The",GB,2021-07-31,2021-08-18,GP0000025,1.75,Already side high require skin treatment.,RE00000004
MOV000342,"Descent, The",GB,2021-11-19,2021-12-11,GP0000003,1.0,Take lay want.,RE00000003
MOV000343,Desperado,GB,2021-07-24,2021-08-08,GP0000005,2.0,Military eight nation out someone case.,RE00000003
MOV000344,Desperate Living,GB,2021-04-18,2021-05-05,GP0000011,1.75,Responsibility dog pay form.,RE00000001
MOV000345,Destroyer,GB,2021-01-23,2021-02-18,GP0000021,1.75,Total red road will.,RE00000004
MOV000346,Detroit Rock City,GB,2021-01-18,2021-02-02,GP0000014,1.5,Exactly seat while few kind according relate.,RE00000001
MOV000347,Devdas (2002),GB,2021-04-24,2021-05-09,GP0000010,1.5,When with property western generation security yard.,RE00000002
MOV000348,"Devil's Backbone, The",GB,2021-11-01,2021-11-27,GP0000005,1.5,Town never talk heavy hundred share sound goal.,RE00000003
MOV000349,"Devil's Rejects, The",GB,2021-04-07,2021-04-18,GP0000009,2.0,Assume series concern into write.,RE00000003
MOV000350,"Devil’s Candy, The",GB,2021-10-14,2021-10-30,GP0000001,1.0,Drug that trade money others.,RE00000003
MOV000351,Dhobi Ghat (2011),GB,2021-06-18,2021-06-28,GP0000023,1.75,Left high morning cell follow.,RE00000004
MOV000352,Dhoom (2004),GB,2021-09-06,2021-10-02,GP0000008,1.75,Green film soldier write.,RE00000003
MOV000353,Die Hard,GB,2021-12-11,2022-01-03,GP0000022,1.0,Lead choose bed growth unit.,RE00000004
MOV000354,Dig!,GB,2021-07-06,2021-07-09,GP0000009,1.5,Tough week church magazine language name say.,RE00000001
MOV000355,Digging Up the Marrow,GB,2021-11-09,2021-11-28,GP0000004,1.75,Possible myself possible modern.,RE00000001
MOV000356,Dil Chahta Hai (2001),GB,2021-09-29,2021-10-14,GP0000020,2.0,Likely seem as painting.,RE00000001
MOV000357,Dil Se (1998),GB,2021-08-22,2021-09-05,GP0000006,1.5,Better tree box life himself.,RE00000003
MOV000358,Dil To Pagal Hai (1997),GB,2021-12-03,2021-12-20,GP0000020,1.0,Term table customer tonight meeting.,RE00000002
MOV000359,Dilwale Dulhania Le Jayenee (1995),GB,2021-08-16,2021-08-18,GP0000012,2.0,Source meeting still region.,RE00000004
MOV000360,Director's Cut,GB,2021-02-22,2021-02-23,GP0000011,1.75,Name nation and also.,RE00000001
MOV000361,"Dirty Shame, A",GB,2021-09-12,2021-09-21,GP0000008,1.5,Economy appear concern while.,RE00000004
MOV000362,Dirty Work,GB,2021-02-12,2021-03-09,GP0000025,2.0,Go daughter it bar daughter tax song oil.,RE00000004
MOV000363,Django,GB,2021-01-06,2021-01-06,GP0000009,2.0,Social thing performance sense open almost.,RE00000002
MOV000364,Django Unchained,GB,2021-02-27,2021-03-07,GP0000018,1.75,Drug Congress main similar seat chance.,RE00000003
MOV000365,Do Bigha Zamin (1953),GB,2021-04-12,2021-04-25,GP0000017,1.0,Break what possible with build discover relationship note.,RE00000004
MOV000366,Do the Right Thing,GB,2021-03-01,2021-03-12,GP0000007,1.0,Policy sport through.,RE00000003
MOV000367,Dog Day Afternoon,GB,2021-01-12,2021-02-07,GP0000023,1.75,Its child just.,RE00000001
MOV000368,Dog Soldiers,GB,2021-02-26,2021-03-21,GP0000004,1.5,Republican military concern bad show.,RE00000004
MOV000369,Dogtooth,GB,2021-10-28,2021-11-10,GP0000021,2.0,Market three own center public either.,RE00000003
MOV000370,Dogville,GB,2021-03-30,2021-04-11,GP0000003,1.75,Technology true truth conference mean.,RE00000001
MOV000371,Don't Breathe,GB,2021-05-02,2021-05-23,GP0000011,2.0,Must until yard professional success wish.,RE00000003
MOV000372,Don't Look Now,GB,2021-04-24,2021-05-07,GP0000012,2.0,Dinner low argue idea turn cover fire feel.,RE00000004
MOV000373,Donkey Skin,GB,2021-06-22,2021-07-04,GP0000006,1.5,Rule local accept find other entire.,RE00000001
MOV000374,Doomsday,GB,2021-07-05,2021-07-11,GP0000013,1.5,Run build alone plant increase week collection.,RE00000001
MOV000375,Dope,GB,2021-10-09,2021-10-19,GP0000007,1.0,Land single service recently with success.,RE00000001
MOV000376,Double Indemnity,GB,2021-08-08,2021-08-20,GP0000007,1.5,Kind do air form carry wall believe.,RE00000001
MOV000377,Doubt,GB,2021-08-13,2021-09-04,GP0000020,1.75,Attention bar suffer themselves social need one.,RE00000003
MOV000378,Downfall,GB,2021-05-12,2021-05-23,GP0000017,1.0,Book data dream strategy rich size.,RE00000003
MOV000379,Dr. Horrible's Sing-Along Blog,GB,2021-08-25,2021-09-19,GP0000021,1.5,Herself good owner forget purpose operation condition project.,RE00000003
MOV000380,Dr. No,GB,2021-08-10,2021-08-13,GP0000022,1.5,Tax beat production perhaps.,RE00000004
MOV000381,Dracula,GB,2021-07-05,2021-07-19,GP0000020,2.0,Act dark later idea threat trouble.,RE00000004
MOV000382,Dracula AD 1972,GB,2021-09-01,2021-09-30,GP0000017,1.75,Factor concern nor per according least woman wear.,RE00000004
MOV000383,Drag Me to Hell,GB,2021-05-26,2021-06-15,GP0000020,1.0,Enjoy must near market likely.,RE00000002
MOV000384,Drive,GB,2021-07-31,2021-08-01,GP0000020,1.75,Bit always some travel mouth.,RE00000004
MOV000385,Drive Angry,GB,2021-06-23,2021-07-12,GP0000015,1.5,Skill among some control administration specific stop.,RE00000002
MOV000386,"Driver, The",GB,2021-06-07,2021-07-03,GP0000007,1.75,Treat change buy international any should you.,RE00000002
MOV000387,Drop Dead Gorgeous,GB,2021-01-13,2021-01-26,GP0000005,2.0,Suggest hair special stock your.,RE00000003
MOV000388,Duck Soup,GB,2021-05-26,2021-06-22,GP0000025,1.75,Mission image total compare.,RE00000001
MOV000389,Dude Bro Party Massacre 3,GB,2021-05-08,2021-05-17,GP0000015,1.5,Industry long up young identify image shake.,RE00000004
MOV000390,Duel,GB,2021-09-30,2021-10-12,GP0000022,1.5,Experience whether save under raise its gas want.,RE00000001
MOV000391,Dummy,GB,2021-02-01,2021-02-11,GP0000004,1.0,Green represent week position heavy white.,RE00000001
MOV000392,Dune,GB,2021-10-30,2021-11-18,GP0000013,2.0,Clear reveal eight long say in too.,RE00000002
MOV000393,"Earrings of Madame de..., The",GB,2021-09-05,2021-10-03,GP0000011,2.0,Think listen child treatment use few any add.,RE00000004
MOV000394,Eastern Promises,GB,2021-06-27,2021-06-27,GP0000017,2.0,Of nothing side activity maybe.,RE00000003
MOV000395,Easy Rider,GB,2021-10-26,2021-11-22,GP0000005,1.0,Than difference start week camera defense situation.,RE00000004
MOV000396,Ed Wood,GB,2021-10-21,2021-11-04,GP0000014,1.5,Relate fight television thousand.,RE00000002
MOV000397,Eden Lake,GB,2021-01-08,2021-01-18,GP0000019,1.5,His father choose whatever just player five.,RE00000001
MOV000398,Edward Scissorhands,GB,2021-07-02,2021-07-28,GP0000022,1.75,Need analysis recognize news.,RE00000002
MOV000399,Eighth Grade,GB,2021-05-19,2021-06-11,GP0000009,1.5,Win sound get money.,RE00000001
MOV000400,Ek Tha Tiger (2012),GB,2021-05-13,2021-06-04,GP0000017,2.0,Student appear determine thank.,RE00000001
MOV000401,El Topo,GB,2021-09-02,2021-09-06,GP0000002,1.5,Use rock nation enough discover firm many.,RE00000001
MOV000402,Elephant,GB,2021-02-20,2021-02-24,GP0000005,1.5,Cover responsibility reason from buy stock.,RE00000002
MOV000403,"Elephant Man, The",GB,2021-05-08,2021-05-20,GP0000007,1.5,Shoulder something involve expert design.,RE00000001
MOV000404,Elle,GB,2021-03-31,2021-04-01,GP0000019,1.5,Mrs month away during body behind.,RE00000001
MOV000405,Elvira's Haunted Hills,GB,2021-04-24,2021-05-13,GP0000002,1.0,Save role pass most writer.,RE00000003
MOV000406,Elvira: Mistress of the Dark,GB,2021-08-19,2021-08-24,GP0000003,2.0,Education start community which.,RE00000001
MOV000407,Emma,GB,2021-06-25,2021-06-30,GP0000018,1.5,Hard any practice sort clear.,RE00000001
MOV000408,"End of August at the Hotel Ozone, The",GB,2021-01-27,2021-02-15,GP0000017,1.0,Eye collection law argue section tonight.,RE00000004
MOV000409,End of Watch,GB,2021-01-19,2021-02-12,GP0000018,1.5,Probably produce ready exist accept current east.,RE00000004
MOV000410,"Endless, The",GB,2021-08-31,2021-09-21,GP0000008,1.5,Such could new street ever under protect.,RE00000004
MOV000411,"Enemies of Reason, The",GB,2021-02-20,2021-02-28,GP0000021,1.75,Population baby mother fact view organization.,RE00000003
MOV000412,Enemy,GB,2021-10-19,2021-11-17,GP0000017,1.0,Big science have despite image election material.,RE00000003
MOV000413,Enter the Dragon,GB,2021-01-13,2021-02-04,GP0000018,1.5,Age resource loss course forget building thank.,RE00000001
MOV000414,Equilibrium,GB,2021-08-29,2021-09-21,GP0000003,1.5,Why church draw hour own.,RE00000001
MOV000415,Eraserhead,GB,2021-08-11,2021-08-17,GP0000016,1.75,About open serious.,RE00000001
MOV000416,Escape from LA,GB,2021-04-12,2021-05-05,GP0000002,2.0,Final consumer such medical lot provide.,RE00000001
MOV000417,Escape from NY,GB,2021-01-28,2021-02-18,GP0000004,2.0,Pretty card central have note figure.,RE00000003
MOV000418,Escape from Tomorrow,GB,2021-06-06,2021-06-17,GP0000001,1.75,Many father agency race democratic.,RE00000004
MOV000419,Eternal Sunshine of the Spotless Mind,GB,2021-09-08,2021-09-21,GP0000021,2.0,Color run resource everybody many edge wrong.,RE00000003
MOV000420,Even Dwarfs Started Small,GB,2021-04-17,2021-05-06,GP0000017,1.75,Hard stand foot form thousand.,RE00000001
MOV000421,Everly,GB,2021-03-11,2021-04-04,GP0000013,1.0,Run including end.,RE00000004
MOV000422,Everybody Wants Some,GB,2021-07-27,2021-08-03,GP0000023,1.5,Difference majority offer thank.,RE00000003
MOV000423,Excision,GB,2021-08-12,2021-08-19,GP0000008,1.75,Price thus tax trip.,RE00000004
MOV000424,Exit Through the Gift Shop,GB,2021-08-04,2021-08-15,GP0000002,1.75,Or rest author beat government cover off open.,RE00000001
MOV000425,"Exorcism of Emily Rose, The",GB,2021-03-26,2021-03-30,GP0000003,2.0,Across above clearly drive.,RE00000002
MOV000426,Expelled,GB,2021-02-18,2021-03-12,GP0000025,2.0,Line within page yard simple car resource.,RE00000001
MOV000427,"Expendables, The",GB,2021-07-04,2021-07-23,GP0000018,1.75,Do within dream behavior.,RE00000003
MOV000428,"Exterminating Angel, The",GB,2021-05-22,2021-06-17,GP0000012,1.0,Return likely start voice goal garden region.,RE00000003
MOV000429,Extra Ordinary,GB,2021-12-08,2021-12-13,GP0000015,2.0,Simply assume least sort without soldier let.,RE00000002
MOV000430,Eyes Wide Shut,GB,2021-11-26,2021-12-18,GP0000015,1.0,Read Congress evidence follow half interest sport who.,RE00000002
MOV000431,Eyes Without a Face,GB,2021-03-01,2021-03-11,GP0000005,2.0,Consider sister those toward.,RE00000004
MOV000432,"Eyes of My Mother, The",GB,2021-11-13,2021-12-11,GP0000020,1.75,Mrs miss tonight.,RE00000003
MOV000433,"FP, The",GB,2021-09-25,2021-10-11,GP0000024,1.0,Card if network often.,RE00000002
MOV000434,"Faculty, The",GB,2021-08-01,2021-08-29,GP0000019,1.0,Reduce true capital.,RE00000002
MOV000435,Fahrenheit 9/11,GB,2021-03-27,2021-04-23,GP0000025,1.0,Manage too data stuff.,RE00000004
MOV000436,Fallen Angels,GB,2021-11-20,2021-12-16,GP0000024,1.75,And most many suddenly when manager success night.,RE00000002
MOV000437,Falling Down,GB,2021-11-25,2021-11-27,GP0000018,1.5,Must hundred carry involve might game theory.,RE00000002
MOV000438,Fantastic Mr. Fox,GB,2021-01-18,2021-02-16,GP0000025,1.0,Daughter again exist organization top.,RE00000003
MOV000439,Fantastic Planet,GB,2021-11-26,2021-12-16,GP0000024,2.0,Network rest certainly house purpose though.,RE00000001
MOV000440,Fargo,GB,2021-06-27,2021-07-10,GP0000007,1.75,Which field either answer.,RE00000001
MOV000441,Fast Food Nation,GB,2021-08-08,2021-08-31,GP0000008,1.75,See must picture class catch call.,RE00000001
MOV000442,"Faster, Pussycat! Kill! Kill!",GB,2021-07-03,2021-07-10,GP0000022,1.5,Arrive cup day tough how again involve.,RE00000001
MOV000443,Fatal Attraction,GB,2021-09-27,2021-10-12,GP0000019,2.0,They debate attorney past training million.,RE00000001
MOV000444,Fear and Loathing in Las Vegas,GB,2021-05-26,2021-06-05,GP0000015,1.75,Agency talk series civil close image.,RE00000002
MOV000445,Fear of a Black Hat,GB,2021-02-27,2021-03-16,GP0000009,1.0,Public authority spend interview good against consider.,RE00000002
MOV000446,Feast,GB,2021-09-25,2021-10-05,GP0000013,2.0,Fact even follow wide.,RE00000002
MOV000447,Female Trouble,GB,2021-11-23,2021-12-18,GP0000008,1.75,Environmental case project low citizen.,RE00000002
MOV000448,Fermat’s Room,GB,2021-03-22,2021-04-08,GP0000024,1.5,Moment recognize exist place though.,RE00000002
MOV000449,"Field in England, A",GB,2021-03-29,2021-03-31,GP0000023,2.0,Dinner really wear everybody leg.,RE00000004
MOV000450,"Fifth Element, The",GB,2021-09-23,2021-10-21,GP0000019,1.75,Admit no company.,RE00000002
MOV000451,Fight Club,GB,2021-03-12,2021-03-17,GP0000014,1.75,Four black really.,RE00000001
MOV000452,Final Destination (Series),GB,2021-03-13,2021-03-20,GP0000008,1.75,Note magazine pull them.,RE00000003
MOV000453,Firestarter,GB,2021-03-12,2021-03-27,GP0000003,1.5,Third recently performance should.,RE00000002
MOV000454,First Cow,GB,2021-06-07,2021-06-09,GP0000019,2.0,Yourself run suddenly apply him.,RE00000001
MOV000455,First Reformed,GB,2021-04-05,2021-04-24,GP0000011,2.0,Short beautiful use country care.,RE00000002
